{
  "schemaVersion": "1.0.0",
  "generatedAt": "2026-02-28T00:00:00Z",
  "contractFingerprint": "sha256:0000000000000000000000000000000000000000000000000000000000000000",
  "functions": {
    "INTEL-F01": {
      "name": "claim_ingest",
      "domain": "intelops",
      "description": "Ingest a new claim into the truth layer via FEEDS.",
      "inputTopic": "truth_snapshot",
      "inputSubtype": "claim_ingest",
      "outputTopics": ["canon_entry", "drift_signal"],
      "outputSubtypes": ["claim_accepted", "claim_rejected"],
      "handler": "core.modes.intelops.claim_ingest",
      "requiredPayloadFields": ["claimId", "statement", "confidence"],
      "emitsEvents": ["INTEL-E01", "INTEL-E02"],
      "stateWrites": ["canon_store", "memory_graph"],
      "preconditions": ["claim has valid claimId", "claim has confidence score"],
      "postconditions": ["claim persisted in canon store", "MG node created"]
    },
    "INTEL-F02": {
      "name": "claim_validate",
      "domain": "intelops",
      "description": "Validate a claim against TTL, contradiction graph, and confidence thresholds.",
      "inputTopic": "canon_entry",
      "inputSubtype": "claim_accepted",
      "outputTopics": ["drift_signal"],
      "outputSubtypes": ["claim_valid", "claim_contradiction", "claim_expired"],
      "handler": "core.modes.intelops.claim_validate",
      "requiredPayloadFields": ["claimId"],
      "emitsEvents": ["INTEL-E03", "INTEL-E04", "INTEL-E05"],
      "stateWrites": ["memory_graph"],
      "preconditions": ["claim exists in canon store"],
      "postconditions": ["validation result recorded"]
    },
    "INTEL-F03": {
      "name": "claim_drift_detect",
      "domain": "intelops",
      "description": "Detect drift from claim validation failures or confidence drops.",
      "inputTopic": "drift_signal",
      "inputSubtype": "claim_contradiction",
      "outputTopics": ["drift_signal"],
      "outputSubtypes": ["claim_drift"],
      "handler": "core.modes.intelops.claim_drift_detect",
      "requiredPayloadFields": ["driftType", "severity"],
      "emitsEvents": ["INTEL-E06"],
      "stateWrites": ["memory_graph"],
      "preconditions": ["drift signal is claim-related"],
      "postconditions": ["drift recorded in MG", "fingerprint tracked"]
    },
    "INTEL-F04": {
      "name": "claim_patch_recommend",
      "domain": "intelops",
      "description": "Generate a patch recommendation from a claim drift signal.",
      "inputTopic": "drift_signal",
      "inputSubtype": "claim_drift",
      "outputTopics": ["canon_entry"],
      "outputSubtypes": ["patch_recommended"],
      "handler": "core.modes.intelops.claim_patch_recommend",
      "requiredPayloadFields": ["driftType", "fingerprint"],
      "emitsEvents": ["INTEL-E07"],
      "stateWrites": ["memory_graph"],
      "preconditions": ["drift signal has fingerprint"],
      "postconditions": ["patch recommendation emitted"]
    },
    "INTEL-F05": {
      "name": "claim_mg_update",
      "domain": "intelops",
      "description": "Update the Memory Graph with claim, drift, and patch nodes.",
      "inputTopic": "canon_entry",
      "inputSubtype": "patch_recommended",
      "outputTopics": [],
      "outputSubtypes": [],
      "handler": "core.modes.intelops.claim_mg_update",
      "requiredPayloadFields": ["claimId"],
      "emitsEvents": ["INTEL-E08"],
      "stateWrites": ["memory_graph"],
      "preconditions": ["claim or patch data available"],
      "postconditions": ["MG nodes and edges updated"]
    },
    "INTEL-F06": {
      "name": "claim_canon_promote",
      "domain": "intelops",
      "description": "Promote a validated claim to canon entry status.",
      "inputTopic": "canon_entry",
      "inputSubtype": "claim_accepted",
      "outputTopics": ["canon_entry"],
      "outputSubtypes": ["canon_promoted"],
      "handler": "core.modes.intelops.claim_canon_promote",
      "requiredPayloadFields": ["claimId", "confidence"],
      "emitsEvents": ["INTEL-E09"],
      "stateWrites": ["canon_store", "memory_graph"],
      "preconditions": ["claim passes validation", "confidence above promotion threshold"],
      "postconditions": ["canon entry created with supersedes chain"]
    },
    "INTEL-F07": {
      "name": "claim_authority_check",
      "domain": "intelops",
      "description": "Verify claim action is blessed by authority slice.",
      "inputTopic": "decision_lineage",
      "inputSubtype": "claim_action",
      "outputTopics": ["drift_signal"],
      "outputSubtypes": ["authority_pass", "authority_mismatch"],
      "handler": "core.modes.intelops.claim_authority_check",
      "requiredPayloadFields": ["claims"],
      "emitsEvents": ["INTEL-E10"],
      "stateWrites": [],
      "preconditions": ["DLR entry has action claims"],
      "postconditions": ["authority verdict emitted"]
    },
    "INTEL-F08": {
      "name": "claim_evidence_verify",
      "domain": "intelops",
      "description": "Verify claim evidence references exist in packet manifest.",
      "inputTopic": "decision_lineage",
      "inputSubtype": "claim_action",
      "outputTopics": ["drift_signal"],
      "outputSubtypes": ["evidence_pass", "evidence_gap"],
      "handler": "core.modes.intelops.claim_evidence_verify",
      "requiredPayloadFields": ["evidenceRefs"],
      "emitsEvents": ["INTEL-E11"],
      "stateWrites": [],
      "preconditions": ["DLR has evidence refs"],
      "postconditions": ["evidence verdict emitted"]
    },
    "INTEL-F09": {
      "name": "claim_triage",
      "domain": "intelops",
      "description": "Triage drift signals by severity and route to appropriate handler.",
      "inputTopic": "drift_signal",
      "inputSubtype": "claim_drift",
      "outputTopics": ["drift_signal"],
      "outputSubtypes": ["triaged"],
      "handler": "core.modes.intelops.claim_triage",
      "requiredPayloadFields": ["severity"],
      "emitsEvents": ["INTEL-E12"],
      "stateWrites": ["triage_store"],
      "preconditions": ["drift signal has severity"],
      "postconditions": ["triage entry created"]
    },
    "INTEL-F10": {
      "name": "claim_supersede",
      "domain": "intelops",
      "description": "Supersede a claim when a retcon or newer evidence arrives.",
      "inputTopic": "canon_entry",
      "inputSubtype": "retcon_executed",
      "outputTopics": ["canon_entry"],
      "outputSubtypes": ["claim_superseded"],
      "handler": "core.modes.intelops.claim_supersede",
      "requiredPayloadFields": ["originalClaimId", "newClaimId"],
      "emitsEvents": ["INTEL-E13"],
      "stateWrites": ["canon_store", "memory_graph"],
      "preconditions": ["original claim exists"],
      "postconditions": ["supersedes edge created in MG"]
    },
    "INTEL-F11": {
      "name": "claim_half_life_check",
      "domain": "intelops",
      "description": "Sweep claims for TTL expiry based on half-life configuration.",
      "inputTopic": "truth_snapshot",
      "inputSubtype": "half_life_sweep",
      "outputTopics": ["drift_signal"],
      "outputSubtypes": ["claim_expired"],
      "handler": "core.modes.intelops.claim_half_life_check",
      "requiredPayloadFields": [],
      "emitsEvents": ["INTEL-E05"],
      "stateWrites": ["canon_store"],
      "preconditions": ["sweep interval elapsed"],
      "postconditions": ["expired claims flagged", "drift signals emitted"]
    },
    "INTEL-F12": {
      "name": "claim_confidence_recalc",
      "domain": "intelops",
      "description": "Recalculate claim confidence based on evidence freshness and contradiction density.",
      "inputTopic": "truth_snapshot",
      "inputSubtype": "confidence_recalc",
      "outputTopics": ["drift_signal", "canon_entry"],
      "outputSubtypes": ["confidence_decay", "confidence_updated"],
      "handler": "core.modes.intelops.claim_confidence_recalc",
      "requiredPayloadFields": ["claimId"],
      "emitsEvents": ["INTEL-E14"],
      "stateWrites": ["canon_store", "memory_graph"],
      "preconditions": ["claim exists"],
      "postconditions": ["confidence score updated", "drift emitted if decayed"]
    },
    "FRAN-F01": {
      "name": "canon_propose",
      "domain": "franops",
      "description": "Propose a new canon entry for blessing and activation.",
      "inputTopic": "canon_entry",
      "inputSubtype": "canon_proposed",
      "outputTopics": ["canon_entry"],
      "outputSubtypes": ["canon_pending_bless"],
      "handler": "core.modes.franops.canon_propose",
      "requiredPayloadFields": ["canonId", "title", "claimIds"],
      "emitsEvents": ["FRAN-E01"],
      "stateWrites": ["canon_store"],
      "preconditions": ["claims exist and are validated"],
      "postconditions": ["canon entry in PROPOSED state"]
    },
    "FRAN-F02": {
      "name": "canon_bless",
      "domain": "franops",
      "description": "Bless a proposed canon entry with authority verification.",
      "inputTopic": "authority_slice",
      "inputSubtype": "canon_blessing",
      "outputTopics": ["canon_entry"],
      "outputSubtypes": ["canon_blessed"],
      "handler": "core.modes.franops.canon_bless",
      "requiredPayloadFields": ["canonId", "blessedBy"],
      "emitsEvents": ["FRAN-E02"],
      "stateWrites": ["canon_store", "authority_ledger"],
      "preconditions": ["canon entry in PROPOSED state", "authority is valid"],
      "postconditions": ["canon entry in BLESSED state"]
    },
    "FRAN-F03": {
      "name": "canon_enforce",
      "domain": "franops",
      "description": "Enforce canon rules against active claims and decisions.",
      "inputTopic": "decision_lineage",
      "inputSubtype": "canon_check",
      "outputTopics": ["drift_signal"],
      "outputSubtypes": ["canon_violation", "canon_pass"],
      "handler": "core.modes.franops.canon_enforce",
      "requiredPayloadFields": ["canonId"],
      "emitsEvents": ["FRAN-E03"],
      "stateWrites": [],
      "preconditions": ["canon entry is ACTIVE"],
      "postconditions": ["enforcement verdict emitted"]
    },